{
  "name": "worktree",
  "version": "0.1.0",
  "category": "core",
  "triggers": [
    "git worktree",
    "parallel writers",
    "branch isolation",
    "separate workspace",
    "conflict-safe coordination"
  ],
  "antiTriggers": [
    "read-only research",
    "single small edit",
    "already isolated harness workspace"
  ],
  "inputs": [
    "user request",
    "SPEC-TO-SHIP.md",
    "project instructions",
    "feature namespace artifacts"
  ],
  "outputs": [
    ".spec-to-ship/features/<feature-id>/worktrees.md"
  ],
  "approvalPolicy": "Ask before irreversible operations or before proceeding past non-trivial spec/cleanup/deploy gates.",
  "verification": [
    "Every worktree has owner and merge target",
    "No overlapping file ownership remains unresolved",
    "Cleanup is delegated to finish"
  ],
  "stopRules": [
    "Stop on unapproved scope change.",
    "Stop on destructive operation without approval.",
    "Stop when required evidence cannot be produced."
  ],
  "toolPolicy": "Use existing user/project tools and preferences; do not require bundled tool-wrapper skills."
}
