{
  "name": "debug",
  "version": "0.1.0",
  "category": "core",
  "triggers": [
    "bug",
    "failing test",
    "CI failure",
    "flaky",
    "regression",
    "root cause",
    "troubleshoot"
  ],
  "antiTriggers": [
    "greenfield planning",
    "known implementation task",
    "pre-merge review without failure"
  ],
  "inputs": [
    "user request",
    "SPEC-TO-SHIP.md",
    "project instructions",
    "feature namespace artifacts"
  ],
  "outputs": [
    ".spec-to-ship/features/<feature-id>/debug-report.md"
  ],
  "approvalPolicy": "Ask before irreversible operations or before proceeding past non-trivial spec/cleanup/deploy gates.",
  "verification": [
    "Reproduction is explicit",
    "Root cause has evidence",
    "Regression coverage or exception is documented"
  ],
  "stopRules": [
    "Stop on unapproved scope change.",
    "Stop on destructive operation without approval.",
    "Stop when required evidence cannot be produced."
  ],
  "toolPolicy": "Use existing user/project tools and preferences; do not require bundled tool-wrapper skills."
}
