{
  "name": "coding-agent",
  "version": "0.1.0",
  "category": "core",
  "triggers": [
    "approved spec",
    "plan implementation",
    "task breakdown",
    "parallelize",
    "delegate"
  ],
  "antiTriggers": [
    "unapproved requirements",
    "single obvious edit",
    "final review"
  ],
  "inputs": [
    "user request",
    "SPEC-TO-SHIP.md",
    "project instructions",
    "feature namespace artifacts"
  ],
  "outputs": [
    ".spec-to-ship/features/<feature-id>/plan.md",
    ".spec-to-ship/features/<feature-id>/tasks.md"
  ],
  "approvalPolicy": "Ask before irreversible operations or before proceeding past non-trivial spec/cleanup/deploy gates.",
  "verification": [
    "Tasks are vertical and independently testable",
    "Parallel slices have ownership boundaries",
    "Every task names validation commands"
  ],
  "stopRules": [
    "Stop on unapproved scope change.",
    "Stop on destructive operation without approval.",
    "Stop when required evidence cannot be produced."
  ],
  "toolPolicy": "Use existing user/project tools and preferences; do not require bundled tool-wrapper skills."
}
